{
  "$schema": "https://json.schemastore.org/claude-code-marketplace.json",
  "name": "wonder",
  "owner": {
    "name": "Wonder",
    "email": "team@wonder.so"
  },
  "metadata": {
    "description": "Create and edit designs with Claude on a canvas where every design is real code.",
    "version": "0.2.4"
  },
  "plugins": [
    {
      "name": "wonder",
      "source": "./plugins/wonder",
      "description": "Create and edit designs with Claude on a canvas where every design is real code."
    }
  ]
}
